name,category,price,store,ratings,reviews,reviews_nr
"INLAND AMD Ryzen 5 3600 6-Core 12-Thread Unlocked Desktop Processor with Wraith Stealth Cooler Bundle with MSI A520M-A PRO Gaming Motherboard (AM4, DDR4, PCIe 4.0, Micro-ATX),",Computer Parts,.,Amazon,4.5 out of 5 stars,"[""The X means you must add a video card as there is no onboard GPU. Not a big deal but just know before you go... The processor is very adequate for most games along with a good video card. I'm really happy with the MSI board. Again you can get better MB's but this one works well to say the least. Great website to help you set things up. Straight forward board, clean and easy to work with. I didn't really like the screws and standoffs... I couldn't get anything to seat correctly so just used better quality items I had on hand. The CPU cooler seems adequate and I haven't had any heating issues. All in all very nice little setup."", ""I'm not docking Microcenter for this as the product was as expected but I will follow up my formal complaint here. The driver threw this about 12ft onto my porch, took her photo, then scurried away before I could get to her it (was in the field out back walking the dog). I sent a complaint at the time of service but it was of course ignored. Otherwise I use this for gaming and 3D modeling, works great. Not the best on speed but it does the job well."", 'Nice motherboard with integrated graphics. Can run games at 108o, but this is not the motherboard of choice for hard core gamers. It is a good choice for an all around home computer that delivers great performance at a modest price', 'The Ryzen 5 5600X is a monster of a cpu even for the age of it. It pairs very well with my RX6700xt and is a monster for most games. I don’t really see too much bottlenecking, only on large games with poor optimization (STARFIELD) but even then I comfortably run games above 150 FPS all day while keeping relatively cool. The Ryzen runs hotter, close to about 56 degrees Celsius with a hotspot temp of like 70-75. With overclocking it’s much much hotter but even at the default settings the CPU hits its max clock speed of 4.7 ghz. I have absolutely no complaints about this CPU, and if you want to game on a budget, get this CPU, for upgradable performance and for even better 1080p/1440p performance.', '', '', ' Purchased this product back in January overall satisfied with it. Just be mindful that the Ryzen 7 5800x might run hotter than expected out of the box (as was my case). Paired with a 3070 32gb ram and a bequiet pure rock 2 for cooling. With everything installed properly but I was having a thermal throttle for a few days. Ended up having to undervolt my cpu by .050 and temps never got higher than 74, ever again. Before the undervolt my clock speed would fluctuate from 3800 to about 4200. After the undervolt my clock speeds are at around 4375+ consistently. There are also many others on the internet who experienced this with said CPU, just something to be mindful of. Definitely still worth the money!', 'Bought this to update my system as it did not have the capability to move forward to Windows 11. Having an ATX motherboard it fit right in my old tower. It was just a ""plug and play"" scenario. I utilized my previous 850W power supply and AMD heat sink as they worked perfectly. I had to buy thermal compound as the other kept getting ""new delivery dates"" so I canceled the delivery. I kept my Nvidia GeForce GTX 1050 Ti 4Gb PCIE 3.0 graphics card as well. The only thing I needed and bought was the motherboard and processor combo, 32Gb DDR4 RAM and a one TB Solid State Drive (SSD). I did a fresh install to the SSD and I formatted my old TB Hard Disk Drive (HDD) into storage. I did not clone my old drive as I made a bootable Windows 11 Pro ISO flash drive. For authentication, I just used my Windows 10 Pro code. I\'m liking the speed of the system especially the SSD Vs the HDD. The new ""snap"" patterns for several windows to be opened. Having two monitors, we have the ability to have eight (8) windows open simultaneously, four per screen. That\'s a bit much but if needed, we have it. This was one of the EASIEST INSTALLS I had for a home tower build.', 'So my previous mother board decided it had raged on long enough. so my brother helped me hunt down this little bundle deal . i went got out a nice gaming case i was waiting on using and slapped it all together and well its smooth as butter. with the video card i got it all just worked so well together. and i did not have to re install windows just install the new hardware so that is a big plus. it has options for days. i find my self ruining out of things to do. i guess if i start editing video or some thing like that it may need to exert its self tho its bin a solid gaming system and im glad i bought it.']","1,215"
"AMD Ryzen 7 5700X 8-Core, 16-Thread Unlocked Desktop Processor",Computer Parts,168.00,Amazon,4.8 out of 5 stars,"[""I've purchased this twice now, that's how much I love it.\n\nThe AMD Ryzen™ 7 5700X desktop processor may belong to the last generation, but it still packs quite a punch and delivers an impressive performance that doesn't disappoint.\n\nUnleashing Power with 8 Cores and 16 Threads:\nWith its 8-core, 16-thread configuration, the Ryzen™ 7 5700X is a true multitasking powerhouse. It effortlessly handles demanding tasks, making it ideal for gamers and content creators alike.\n\nSeamless Gaming Experience:\nWhen it comes to gaming, this processor is a force to be reckoned with. It delivers smooth and lag-free gameplay, and the 8 cores ensure that modern games run like a dream, even with demanding graphics.\n\nEditing Videos Like a Pro:\nFor content creators and video editors, the Ryzen™ 7 5700X is a reliable companion. Its multithreaded performance shines during video editing tasks, reducing rendering times and enhancing overall productivity.\n\nUnlocked for Overclocking:\nEnthusiasts will appreciate the unlocked nature of this processor, allowing for easy overclocking to squeeze out even more performance when needed.\n\nCompatible with AM4 Socket:\nThe Ryzen™ 7 5700X fits the AM4 socket, making it compatible with a wide range of motherboards. This ensures future upgradability and versatility in building your dream system.\n\nReliable Cooling Solutions:\nThe processor comes with a capable stock cooler that does a commendable job at keeping temperatures in check during regular use.\n\nGreat Value for Performance:\nThough it's from the last generation, the Ryzen™ 7 5700X continues to offer excellent value for its performance. It competes admirably with newer counterparts in its price range.\n\nFuture-Proof for Everyday Tasks:\nFor everyday computing tasks, this processor is future-proof. It's more than capable of handling web browsing, office work, and other day-to-day activities with ease.\n\nFinal Verdict:\nIn conclusion, the AMD Ryzen™ 7 5700X 8-Core, 16-Thread Unlocked Desktop Processor is a testament to AMD's commitment to delivering powerful and efficient processors. While it may belong to the last generation, its performance is nothing short of impressive. Gamers, content creators, and everyday users will find a lot to love in this processor, thanks to its multitasking capabilities and smooth gaming experience. If you're looking for a cost-effective option that can handle both gaming and productivity tasks without breaking the bank, the Ryzen™ 7 5700X is undoubtedly worth considering. It's a reliable performer that stands the test of time and continues to shine in various computing scenarios."", ""I recently built my first PC and opted for the AMD Ryzen 7 5700X processor, and I couldn't be more thrilled with my choice. Although this is an AM4 CPU, this processor is an absolute game-changer, offering exceptional performance right out of the box. Whether I'm streaming content, gaming, or tackling demanding projects, this processor handles everything effortlessly.\nI also want to point out one of the most impressive aspects of this processor, which is its energy efficiency. Despite its robust performance, it runs cool and consumes minimal power.\nI highly recommend this to anyone seeking a top-tier CPU for their system."", ""Fantastic, affordable performance for gaming now that we're in the twilight of AMD's long-lived AM4 platform.\nYou will need a dual-fan heat sink like the very affordable Thermalright Peerless Assassin along with a video card."", 'I use my PC for a mix of gaming and productivity and I have nothing but praise. I have this CPU matched to the Be Quiet! Pure Rock 2 for cooling. My unit hangs around 76 degrees Celsius running Cinebench R23 without overclocking, scoring 14,300. For productivity, it is a beast. photo processing on RawTherapee is a breeze, especially compared to my previous Ryzen 5 2600. It just goes so much faster. Before purchasing this, it might be worth checking out the price on the 5800x, as there are often discounts that make the prices comparable. Also, if you believe that most of your time is going to be spent gaming, the 5700X3D and the 5800X3D may be better options, although you might need to spend more. Overall, it is a great processor for doing a little bit of everything, but it might lag behind the X3D variants in gaming.', 'Bought in 2024 on the “dead” AM4 platform. Frankly, just because tech improves doesn’t mean it’s dead and this is a perfectly good eight-core CPU that fast and would probably satisfy 95% of average users. At the time of buying, this CPU was about $170, which is very good value considering the rest of AM4 platform (great mobo deals) is very good value in my opinion. Sure, it’s not bleeding edge, but who wants blood on their edge anyways? We can feel satisfied with much of AM4’s offerings.', ""This was on sale temporarily for only $20 more than the 5600x. Works great in games, gives me a little more overhead. More than enough power for what it's used for."", ""Working fine, ran it through Cinebench and played a few games. Definitely an improvement over what I had. However, it had 5 bent pins out of the box. Which means the only two AMD processors I've bought have arrived with bent pins. Now I was able to get them back into place and nothing seems to be damaged, but it's just so disappointing this happened again."", 'I just did a fresh build and picked this for the heart. Running it with 32gb of gskill ram and an rx7600 and this thing is a monster for 1080p gaming, even does great at 1440 on most titles. best cpu in this price range without a doubt.', 'Processador extremamente forte e eficiente, é exatamente oque eu precisava!', '', ""Coming from a 3300X to the 5700X has been very good. I find a lot less stuttering in games and multitasking, and a nice performance boost all around. Probably the best price to performance you'll find on AM4 in 2024."", 'Es un producto bastante bueno y barato, tiene una potencia increíble. Ademas el pedido llegó muy rapido', '', 'Ist als Upgrade für einen Ryzen 5 3500x gekauft worden und ich würde ihn wieder kaufen. Leistungsstark und sparsam. Läuft mit einer NVIDIA RTX 3060 12GB ausgezeichnet !!!', '', 'Great upgrade from previous CPU.']","6,018"
"AMD Ryzen 5 7600X 6-Core, 12-Thread Unlocked Desktop Processor",Computer Parts,199.98,Amazon,4.7 out of 5 stars,"[""The AMD Ryzen™ 5 7600X is a gaming powerhouse that brings exceptional performance to the desktop gaming experience. With its six cores, twelve threads, and unlocked multiplier, this processor is designed to cater to the needs of gamers seeking high-speed, multitasking capabilities. In this review, we'll delve into the key features that make the AMD Ryzen™ 5 7600X a formidable choice for gaming enthusiasts.\n\nThe Ryzen™ 5 7600X impresses with its six cores and twelve threads, providing a perfect balance for gaming and multitasking. The unlocked multiplier allows for easy overclocking, letting users push the processor beyond its base clock speeds for even more gaming performance. Whether you're engaged in intense gaming sessions or running demanding applications, the 7600X delivers smooth and responsive performance.\n\nFor gamers, the Ryzen™ 5 7600X is a dream come true. Its six cores ensure that modern games, many of which are optimized for multi-core processors, run seamlessly. The high clock speeds and efficient architecture contribute to low-latency gaming, reducing stutter and lag. Additionally, the processor's compatibility with Precision Boost technology optimizes performance based on workload, further enhancing the gaming experience.\n\nThe Ryzen™ 5 7600X is based on the AM4 platform, ensuring compatibility with a wide range of motherboards. This platform's longevity and AMD's commitment to supporting it make the 7600X a solid choice for those looking to future-proof their gaming rigs. Additionally, AMD's continued driver support enhances the processor's compatibility with the latest games and applications.\n\nIn summary, the AMD Ryzen™ 5 7600X stands out as an excellent choice for gamers seeking a powerful and cost-effective desktop processor. With its impressive core count, unlocked multiplier, and stellar gaming performance, the 7600X delivers an immersive gaming experience. While users should consider investing in a separate cooling solution, the overall value and compatibility make the Ryzen™ 5 7600X a worthy investment for anyone looking to build a gaming PC that can handle the demands of modern titles."", 'I recently created a new build and have been extremely impressed with the performance of this CPU. The CPU paired with this GPU runs every game I have played (Warzone 3, Rocket League, and XDefiant) at max FPS on 1920 x1080p. Benchmarked as a UFO in all 3 categories and has been wicked fast - excited to see how it performs as time goes on.\n\nExtremely good value for the price!\n\nBuild:\n- Ryzen 5 7600x\n- XFX 6750 xt\n- TUFF Gaming B650 Plus Wifi MOBO\n- CORSAIR Vengeance 32GB 6400 MHz', ""My DDR3 build was an AMD 8370, the performance is great. Those extra 4 cores were worth the upgrade. I was hoping to run Windows 11 and keep runing my old build.\n\nI was debating between the 8400 and this. The 8400 would have ran my GPU at a lower rate because the motherboard so the 7600x was a better choice without limiting my graphics.\n\nIts stable and seems ready to take any challenge. My idle temp is 40c, gaming 60c, I did see it raise to 90c but the fans reacted quickly bringing it back to 40c.\n\n*I know the thermal paste I used wasn't my usual but I'll be ordering my usual paste next. I'll update this review later this week.\n\nThank you Amazon for a quick delivery."", ""I have absolutely zero complaints about this processor. I originally had a 7700X, but I decided to sell it and get the 7600X in its place- that was a perfect decision. The 7600X is an absolute powerhouse. While you do lose a couple of cores, and may lose some productivity performance in terms of video editing and graphic design, there is barely a difference when it comes to games.\n\nIn the games I tested, such as Cyberpunk, GTA V, RDR2, and Borderlands 3, I averaged only about a 2-4 FPS difference compared to when I was using the 7700X. It also helps extensively with cooling, as this only has a TDP of 65W at its best efficiency compared to the 7700X's 105W. However, despite the lower TDP, the 7600X can still get fairly hot, as I still found that my AIO wouldn't stop it from still reaching the lower 80's in more demanding titles.\n\nOne major thing to note about the 7600X (or all AM5 processors in general) is that due to the new heat spreader design, you will need to make sure that you use a compatible cooler that uses a mounting system that will still apply adequate pressure, and also to be careful if you ever need to remove the CPU as it is harder to grip it by the sides. It's also very easy for thermal paste to fall into the grooves of the new IHS, but this won't be an issue as long as you steer clear of metal-based thermal solutions (unless you know what you're doing.)\n\nOverall, the Ryzen 5 7600X is the best value bargain deal in terms of ALL CPUs on the market right now- regardless if you prefer AMD or Intel. There is simply no CPU with as much performance, versatility, and general range of use in terms of its cost. Additionally, the periodic sales make it even more of a value deal, and I would definitely suggest getting the 7600X over all the other options if all you primarily do is streaming, gaming, or general use. I highly recommend it!"", 'Es verdad que está generación de Ryzen se calienta pero por el precio no vas a encontrar nada mejor solo compra una buena refrigeración y listo lo recomiendo mucho', '', 'Olá, como vai? venho informar algumas coisinhas sobre essa compra.\n\nentrega: comprei no dia 16/03 e recebi no dia 19/04 ( mais de 1 mês antes do prazo que era de até dia 04/06 )\nembalagem: veio bem embalado, caixa chegou intacta.\nprocessador: testado, funcionando perfeitamente.\n\nutilização: processador foi instalado em uma placa mãe relativamente barata (biostar b650mt R$ 599,00) estou utilizando um air cooler (ak500s digital R$ 250,00 )\nestou com memorias a 6000mhz sem conflito nenhum.\ntestes: com este kit, temperatura em standy by está em cerca de 45 graus, temperatura durante jogos por volta de 65/75 graus ( fica variando )\ntemperatura máxima? utilizando o programa funmark para estresse do processador, tive o máximo de 84 graus. ainda fora do limite.\nportanto, está em duvida de qual processador comprar para sua plataforma am5, recomendo esse com toda certeza.\n\npelo valor que paguei, acredito que nao tenha custo beneficio melhor do que esse para a plataforma am5', '', 'I bought this for my new PC build and it\'s a very good CPU that can run any game that you can think of. Well of course paired with a specific GPU that won\'t bottleneck. This CPU can also be good to used for video editing, video streaming, etc.\n\nThis CPU requires an AM5 Motherboard\n\nI have had nothing but good performance. I have not overclocked my CPU or PC, in general, there is no point in overclocking unless you want to, it\'s personal preference. But, this ryzen 5 7600x can still run very well without being overclocked.\n\nThe price is worth it if you are looking for a CPU that should last for at least; the 2030s, since ryzen will release AM5 CPU generations for another couple more years 2-4 years or more. So in the future, you could upgrade your CPU to a newer version if you want. until ""AM6"" ever comes out', 'De lo mejorcito que se puede comprar en 2024, lo tengo con una 4070ti y de 10', '', 'Hatte noch einen 2700x. Moderner Prozessor mit mehr Performance. Bin sehr zufrieden. Mehr Leistung in allen spielen.', '']","1,605"
"AMD Ryzen 5 5600 6-Core, 12-Thread Unlocked Desktop Processor with Wraith Stealth Cooler",Computer Parts,126.80,Amazon,4.8 out of 5 stars,"[""As of this review I have already upgraded as planned to a 5800x3d with an aftermarket cooler and used those for a while but here is my review from memory.\n\nThe 5600 and X variant DO NOT have on-board graphics if you are building with that in mind please look at the 5600g variant or a newer APU.\n\nThis CPU was a massive upgrade for me in gaming and even more for productivity from a very old Intel CPU so take that with a grain of salt.\n\nIn gaming this is a very powerful CPU for the vast majority of people. If you are gaming under 144hz and on a budget this is easily one of the best you can get from this generation.\n\nThis is continually one of, if not the highest, value cpu's as it comes with a very beefy performance for its cost and a cooler all in one package.\n\nI had near-flawless performance when used on my 144hz 1440p monitor in most of my games. I generally reduce in-game settings to accommodate higher framerate which does often reduce CPU load as well but reducing max framerates to 120 and more-so 90 at comparable settings would be even more ideal if going for higher settings or a smoother 1% framerate experience for fast games.\n\nProductivity - I had two monitors and often I watch videos, streamers, chat with friends and browse(browsers can be quite CPU intensive at times due if not using hardware-encoding which in my case I did not due to compatibility issues with other software)\n\nAll-in-all if you are building a new system, you may want to look at the newer AMD 7600 lineup as it is very similar, but if squeezing out a smaller budget with a very good sale or a used purchase, the 5600 will last you at minimum 4 years without issue."", 'The 32MB of L3 cache on the 5600 and the strong single-core performance (I know, not cutting-edge single core perf. anymore in 2023, but still...) made this CPU a lifesaver for my framerate in modded Minecraft around the animal pens in my base (the kind of scenario where Minecraft proves to be the most CPU-bottlenecked experience of any PC game, in my experience).\n\nI upgraded to this from a Ryzen 7 1700, and noticed a drastic difference in performance with otherwise the same hardware.\n\nHere\'s the rundown of the performance difference I experienced from upgrading from Ryzen 7 1700 to Ryzen 5 5600 (see also the picture):\n[] ~30% improvement to 0.1% lows in Unigine Superposition @ 1080p Extreme (This means, much more stable framerate without stutters)\n[] ~12% improvement to 0.1% lows in MSI Kombustor MSI-01 OpenGL test 1080p (This means, more stable framerate without stutters)\n[] ~46% across-the-board improvement to average framerate, 1% lows, and 0.1% lows in Minecraft running what I call ""The chicken test"" (simulates lag around lots of active mobs)\n[] ~19% across-the-board improvement to average framerate, 1% lows, and 0.1% lows in Horizon Zero Dawn at 1080p Ultra Quality/Max settings\n[] ~51% single-core performance uplift in Cinebench R23\n[] ~23% multi-core performance uplift in Cinebench R23\n\nAll in all the Ryzen 5 5600 is a fantastic budget upgrade if you have an older AM4 system. The motherboard being used here is an ASRock B450M A/C R-2.0.\n\nI have just upgraded the RAM now too and endeavor to see what the performance difference is with faster-clocked RAM versus the older RAM speeds on the 5600 that were same as what the Ryzen 7 1700 was running at.', ""This is my second time buying this cpu. Sadly the first one died on me, it had to be overclocked to run and eventually it needed to overheat to even work or turn on and it just eventually wouldn't boot.\nSo after carefully deliberating whether it was ram, motherboard or cpu, I bought ram, it didn't work. Went to the drawing board and did more tinkering and decided it had to be the cpu as said above. It's a very good cpu, but not entirely sure on quality, could've just been bad. Enable ReBar, PBO and XMP and you're good to go. Best paired with an AIO, with the original fan, it hit temps of 86c. Not good for me. AIO got me running 36c average and about 44c active and jumping to 50c occasionally. It hits advertised speeds and runs everything well. However I've noticed my usage does spike pretty high with what I run. So if you're a pretty heavy user, something a bit bigger might be better.\n\nI haven't run into performance issues with any games. At max 70% to 76%. Most times running around 20 to 30%. If you can get this cpu for about 115$, grab it. I wouldn't pay more than 120$."", 'Deus abençoou e ganhei na loteria do silício, veio praticante um Ryzen 5 5600x.\nFazendo PBO e CO e ficou excelente, exatamente igual a versão com X em stock (observando a temperatura e consumo ok?)', '', 'The Ryzen 5 5600 is seriously awesome for its price! It handles everything I throw at it like gaming and multitasking without any hiccups. No upgrade path going with this CPU since AM5 is here but still a decent option.', 'Despues de casi 3 años de uso y que ha llegado la serie 5000 y pronto la serie 7000 en AM5; puedo decir que es un gran procesador, por un precio muy accesible.\n\nPasar del R5 2600 al R5 5600 es la mejor opcion y ademas estan al momento de escribir esta reseña al ""mismo"" precio que cuando el R5 2600 se lanzó.\n\nSi buscan darle un ultimo respiro a sus equipos aun teniendo AM4 y chipset X370, B550 o X570 esta es una excelente opción de bajo costo al menos para darle vida a su equipo sin rezagarse mucho en lo que DDR5 se vuelve la normalidad quiza por el 2025 o 2026, mientras tendran un gran procesador.\n\nEDIT. Devolvi el CPU despues de 10 días de intentar hacer jalar la PC con este CPU, me costo una motherboard brickeada (x370-F Gaming), una nueva fuente de poder (RM850) que son 5000-6000 pesos por que esta pieza no funciono.\n\nSi su computadora, empieza a hacer cosas raras despues de instalar una pieza que vender Amazon Remates de Almacen, mejor devuelvanla lo mas rapido posible y compren algo nuevo y sellado antes que les heche a perder mas piezas y gasten mas (como en mi caso).\n\nNo le quito estrellas por que hacen la devolucion integra, pero mientras este CPU defectuoso que compre por ahorrarme 200MXN me hizo gastar 6000 extras, ustedes diran si vale la pena ahorrarse 200.', '', ""The AMD Ryzen 5 5600 with Wraith Stealth Fan is a powerhouse CPU that delivers exceptional performance and efficiency. Whether you're gaming, streaming, or tackling intensive tasks, this processor handles everything with ease. The included Wraith Stealth Fan ensures reliable cooling without excessive noise, keeping temperatures in check during demanding use. If you're looking for a high-performance CPU that offers great value for money, the AMD Ryzen 5 5600 is a top choice."", 'Wydajny, ale poprzednie generacje były mniej prądożerne i ciut chłodniejsze.....', '']","5,153"
