name,category,price,store,ratings,reviews,reviews_nr
"AMD Ryzen 5 3600 6-Core, 12-Thread Unlocked Desktop Processor with Wraith Stealth Cooler",Computer Parts,79.00,Amazon,4.8 out of 5 stars,"['The AMD Ryzen 5 3600 is a game-changer! From seamless gaming to smooth content creation, this CPU delivers top-notch performance without breaking the bank. Easy installation, exceptional multitasking, and unbeatable value make it a must-have for any PC enthusiast. Highly recommended!', 'I have been using this for years now, it still works very well. Great for my budget build', 'Have had this product for two years and have not been disappointed! Easily handles video editing and processing on my Pinnacle Studio 26 software. Price of purchase fit my budget when I built my PC for medium level video editing and processing. Quickly deals with EXCEL spreadsheets for over 3000 entries and PowerPoint slide presentations with audio and video.', ""AMD has really done a great job in catching up and overtaking Intel. The Ryzen 5 3600 was, hands-down, the best budget CPU when I purchased it in 2020. For $200, this thing is an absolute powerhouse. This CPU will easily handle ANY games you throw at it, and can even stream at the same time without maxing out (at least from my experience). It ranks VERY well against its contemporaries (as long as you don't use UserBenchmark).\n\nIt does run a bit hot, but the Wraith cooler that comes with it is enough to keep thermals within comfortable ranges. I use a 120mm AIO (which isn't the best CPU cooling method) and I rarely hit temperatures that exceed 75 while gaming.\n\nOne thing I should definitely say now, in the era of Intel 11th-gen and AMD Ryzen 5000, this CPU is not worth it at prices above $200. The i5-10400 is running at $150-175. It may not be as good as the 3600, but it still is a good CPU and is much more affordable. Seeing this listing here that has the CPU at $240 is not good considering that we are in the era of Ryzen 5000 and Intel-11, AND Intel is tanking the prices of its 10th-generation processors.\n\nI am AMD all the way, but if AMD still wants to out-compete Intel in previous-generation sales, they will have to get competitive in the price area. If they do, then this CPU will definitely be a no-brainer buy for a budget builder since this CPU is still more than viable now.\n\nTL;DR - Worth it for $200 in 2020, not worth $240 in 2021 with the existence of Ryzen 5000 and Intel 11th-Gen. Still a very capable GPU for gamers. Would be more than worth it if price dropped to around $175."", 'Works good', ""Came in perfectly fine, didn't have a single issue with it besides the fact that the thermal paste wasn't pre applied so make sure you have some just in case. The graphics are very good, it's smooth in games, boots up like it should. This is definitely worth it's price. The spire cooler is bigger than the stealth so be sure to do some research on which would fit in your PC or perform better."", 'Installed on a fresh build 4/16/24.\n\nThis processor is great for an entry-level or budget build. It’s a great value that really puts in a lot of work on only 6 cores.\n\nInstall was easy, and it booted up no problem. I have not tracked specific temperatures, but this build doesn’t really require anything too strenuous.\n\nTwo demerits contributed to the missing star.\n1: The packaging was a bit weak. Plastic molds meant to hold the fan and cpu were broken and gave me cause for concern. (After inspection, I found all was well, but it’s never fun to hear a computer part rattle in the box.)\n2: The fan comes with past already applied. I like that this inclusion makes the cpu immediately install-ready; however, the paste looks a bit dried out. I would prefer the paste to be included in tube form in the box. Putting on fresh paste makes me feel a whole lot better.', 'THis was bought to update an older am4 motherboard. This is a tried and true cpu chip. If i didnt have a newer ryzen 5000 chip this would be my go to for my childs build.', 'Al dia de escribir esta reseña ya hay mejores procesadores que este, pero en su momento fue uno de los mejores procesadores calidad-precio', '', ""Performs well for a 1080p gaming build, or for casual use. Even able to play a lot of the newer titles if paired with the right GPU. While there are certainly more powerful processors out there, this is a great buy for someone wanting to dip their toes into the PC space without too much of an investment. Even comes with its own cooler, which I'd recommend upgrading if possible, but it does the job."", 'Great processor for the price. Performance is strong and it keeps up with modern games, temperatures are never an issue either.', 'o processador chegou em perfeito estado, todos os pinos retos, e funcionando perfeitamente, já testei em alguns jogos, e já percebo uma diferença. estou agora escrevendo esse post com o próprio PC com o processador. o produto é tal como prometido, e uma nota interessante é que o cooler já veio com uma pasta térmica aplicada, então foi extremamente fácil de instalar.', '', 'Perfect for my daughter to play Fortnite with. Runs smooth and cool.']","43,735"
"AMD Ryzen 5 5600X 6-core, 12-Thread Unlocked Desktop Processor with Wraith Stealth Cooler",Computer Parts,141.00,Amazon,4.8 out of 5 stars,"[""I recently upgraded my computer's CPU to the AMD Ryzen 5 5600X 6-core processor, and the results have been nothing short of impressive. As a user who values both gaming and productivity, this CPU has exceeded my expectations in delivering exceptional performance across various applications.\n\nThe Ryzen 5 5600X's 6-core configuration, coupled with its 12 threads, provides a perfect balance for multitasking without compromising on speed. The base clock of 3.7 GHz, combined with the ability to boost up to 4.6 GHz, ensures swift and responsive performance across a range of tasks. Whether I'm gaming, video editing, or running resource-intensive software, the processor handles it all with ease.\n\nIn terms of gaming, the Ryzen 5 5600X has significantly enhanced my overall experience. The Zen 3 architecture brings notable improvements to single-threaded performance, resulting in smoother gameplay and quicker load times. The 6-core design proves to be a sweet spot for most modern titles, striking an ideal balance between price and performance.\n\nThe CPU's power efficiency is another standout feature. The 7nm process technology ensures that the Ryzen 5 5600X runs cool and consumes less power, contributing to a quieter and more energy-efficient system. This is a noteworthy benefit for users who prioritize a quieter computing environment or those building a system with a focus on sustainability.\n\nThe included Wraith Stealth cooler is a nice addition, providing adequate cooling for everyday use. However, for users planning on overclocking or pushing the processor to its limits, investing in an aftermarket cooler might be a worthwhile consideration.\n\nIn terms of compatibility, the Ryzen 5 5600X seamlessly integrates into existing AM4 motherboards with a BIOS update, making it a convenient choice for users looking to upgrade without changing their entire system.\n\nIn conclusion, the AMD Ryzen 5 5600X is a stellar performer that strikes an excellent balance between price and performance. Whether you're a gamer, content creator, or a multitasking enthusiast, this 6-core processor delivers a compelling mix of power and efficiency. The upgrade has undeniably elevated my computing experience, and I highly recommend the AMD Ryzen 5 5600X to anyone looking for a reliable and high-performing CPU."", ""If you are looking for a powerful and affordable CPU for your next PC build, you should definitely consider the AMD Ryzen 5 5600X. This processor offers 6 cores and 12 threads, which means it can handle multitasking and demanding applications with ease. Whether you are gaming, streaming, editing, or rendering, the Ryzen 5 5600X will deliver smooth and responsive performance.\n\nThe Ryzen 5 5600X is based on AMD's Zen 3 architecture, which improves the IPC (instructions per cycle) by up to 19% compared to the previous generation. This means that the Ryzen 5 5600X can achieve higher clock speeds and lower latency, resulting in faster and more efficient processing. The Ryzen 5 5600X also supports PCIe 4.0, which enables faster data transfer between the CPU and other components, such as SSDs and GPUs.\n\nOne of the best features of the Ryzen 5 5600X is its price. At $159(price may vary), it offers an outstanding bang for your buck, especially when compared to its competitors. The Ryzen 5 5600X outperforms the Intel Core i5-10600K in most benchmarks, while costing less and consuming less power. The Ryzen 5 5600X also comes with a decent stock cooler, which saves you some money and hassle.\n\nThe Ryzen 5 5600X is a great choice for anyone who wants a high-performance CPU without breaking the bank. It is compatible with most AM4 motherboards, so you don't have to worry about upgrading your whole system. It also has a lot of headroom for overclocking, if you want to squeeze out even more performance. The Ryzen 5 5600X is a versatile and reliable processor that will serve you well for years to come.\n\nI hope you enjoyed this review of the AMD Ryzen 5 5600X. If you have any questions or comments, feel free to leave them below. Thanks for reading!"", ""The AMD Ryzen 5 5600X processor has revolutionized my PC gaming experience, and I couldn't be happier with my purchase. This little gem packs a powerful punch, significantly boosting my computer's performance and making it the ideal choice for gamers and multitaskers alike (while not breaking the bank).\n\nWith its snappy processing speed and six cores, my PC now handles everything I throw at it with ease. Whether I'm playing graphics-intensive games or running multiple applications simultaneously, the 5600X effortlessly keeps up, eliminating annoying lags and slowdowns.\n\nWhat really impressed me was how well it handles the more modern games. The processor's architecture and high clock speeds ensure smooth gameplay and vibrant graphics, making every virtual adventure feel incredibly immersive. And the best part? It doesn't break a sweat, even during extended gaming sessions. I also want to mention that I was able to Overclock it effortlessly from its base 3.7GHz to a blazing 4.65GHz while maintaining <35°C using the MSI MEG Coreliquid S280 CPU cooler.\n\nInstalling the processor was a breeze. The compatible AM4 socket made the upgrade process seamless, and I didn't encounter any compatibility issues with my existing components. Plus, the processor's energy efficiency meant I didn't have to worry about upgrading my PSU either.\n\nThe Ryzen 5 5600X's affordability is the icing on the cake! Compared to other processors in its league, this one offers outstanding value for its price, making it an excellent investment for budget-conscious gamers and computer enthusiasts.\n\nThe only downside I could find is that it doesn't come with integrated graphics. However, that wasn't an issue for me since I have a dedicated graphics card (AMD RX6650 XT 2X OC). For those who rely on integrated graphics, it's essential to pair this processor with a compatible GPU.\n\nIn conclusion, the AMD Ryzen 5 5600X processor is a true game-changer for my PC. Its blazing-fast performance, gaming prowess, easy installation, and wallet-friendly price tag make it a standout choice for anyone looking to level up their computing experience without breaking the bank. Highly recommended!"", 'For 6 years, my CPU was a Ryzen 5 1600X. It still did pretty decently, but needless to say, I needed to upgrade badly.\n\nThe Ryzen 5 5600X is definitely what I needed. It runs way hotter than the 1600X though. Temps are usually in the 40s at idle and reaching up to 81c so far when I game.\nAt first, I thought I had caused this by messing up with the thermal paste. I had a lot of difficulty screwing in the fan and I had to slide it around to get it in the right spots, so I got scared that I scraped off some paste in the process.\n\nTurns out, It\'s......... just a very hot CPU. This is common. You can safely go to 95c.\n\nI read that there\'s a setting called ""Precision Boost Overdrive"" that basically runs an overclock automatically and that turning it off in BIOS will help lower the temps. I haven\'t done that yet, but I may if temps go higher.\n\nAll the games I\'ve thrown at it run much better with no issues. Videos render much quicker too. And my PC\'s performance is much more stable.\n\nAll in all, I can\'t complain. Good price for great performance.', 'Excelente custo beneficio e roda tudo o que preciso', '', 'Armas algo muy bueno si eres paciente y lo combinas con una buena tarjeta gráfica', '', 'Fungerar som den skall och var stabil med minnen på 3600 MT/s, vilket inte gick med min Ryzen 5 3600.', '', 'Gute CPU zum Top Preis... ich habe die CPU gleich 2 x erworben und sowohl Ryzen 2700x, als auch Ryzen 1600x damit ersetzt...30% mehr single core Leistung und doppelte Leistung beim Packen von Dateien und 30% weniger Watt, das lohnt sich im Vergleich zu den alten 2018er CPUs.', '']","25,406"
"AMD Ryzen 5 3600X 6-Core, 12-Thread Unlocked Desktop Processor with Wraith Spire Cooler",Computer Parts,199.00,Amazon,4.8 out of 5 stars,"['This CPU is amazing. It is great at everything. It can game, multitask, stream, productivity, and more. It’s priced good enough that even if you just want it for general computing it’s still great. This thing comes pushed to the limit straight out of the box pretty much. Traditionally I overclock every CPU I buy but with this one AMD have pretty much pushed them to the max for us. Which is great because it’s plug n play! Mine with PBO and Thermal Limits set to max stays around 4.250ghz on all cores gaming under full load with 1 of the 6 cores boosting to 4.35-4.15ghz. So in a game 5 cores will be at 4.250 ghz and one core will always be around 4.35-4.15ghz with that 1 core alternating so they take turns. This gives great ipc and single threaded performance as well as multithreaded. This gives high FPS in games due to the strong single core performance than a 4.3ghz all core overclock gets. You can basically set PBO to max and TBU to max and your motherboard and system will boost it as high as it can. It’s amazing it’s literally drop it in and your good to go this time around. No overclocking needed. I have this CPU in the Asus Prime X570-Pro motherboard if anyone was curious. It was 260 dollar board so it’s pretty nice imo. So your numbers may be different than mine. For cooling I’m using a simple Cooler Master Hyper 212 Evo in Push/Pull with twin fans. Keeps my CPU in the mid 30sC idle, in the 50sC in gaming rather it’s an hour or all day long. Under Prime 95 stress test it topped out at 76C then dropped back to 74C and stayed there. For a 35 dollar cooler pretty insane. I have great case air flow so if you do not do not expect these results. The best way to get more performance from your Ryzen CPU since it’s basically pushed to the max out of the box is via memory. You can look it up if you wish. Memory speed significantly effects your cpus performance at least in gaming. It was shown going from 2666mhz to 3600mhz memory speed in games was giving huge FPS increases. In almost all games 10-20 FPS increase with some games increasing as much as 30-40fps. So if you buy a Ryzen CPU for the love of god buy 3600mhz memory with it. I have 32GB of G.Skill Ripjaws in mine all running at 3600mhz and that’s using all 4 dimm slots 4x8GB sticks in duel channel mode. Fast memory paired with this CPU in a good motherboard means you don’t have to overclock or touch anything this time around and you get amazing performance in all regards. I have my 3600x and 3600mhz memory paired with a RTX 2070 Super that is overclocked really well and I am playing any games I want at 1440P maxed out getting 100+ FPS in pretty much everything. If you want a nice CPU for gaming, streaming, content creation, or anything else well you’re looking at one. At this point in time the Ryzen 3600XT is out now which is basically this exact CPU except it runs around 4.6ghz in the boosting alternative core and probably around 4.4 on the other 5 core. So you gain roughly about 200mhz over this 3600x by going with the XT. Rather that’s worth it well that’s up to you. At most the difference in FPS between the two might be 5 FPS at max. So just get whichever is the best deal. Even the Ryzen 3600 non X or non XT does very very similar in performance to the X and XT and is 150 dollars right now. Everything I said pretty much applies to all 3 CPUs they are just an amazing gaming chip.', 'Got it for 90 bucks....well worth the upgrade since when I built my Ryzen PC, I went super cheap on the CPU just to get a better GPU....now that I got this Ryzen 5 3600x to go with my RX 5700xt...the GPU is now the bottle neck instead of the CPU. Great for workstation and better then expected for gaming. Best CPU for the money IMO. Reminds me of the old FX days when everyone said they were low tier...but in my experience, they preform so much better then intel when it comes to cost/performance. Is it the fastest ever made? Of course not...it was 90$!', ""I will admit, I was hesitant to buy an AMD CPU. The benchmarks put it competing with Intel CPUs that cost nearly twice as much, so even though I've used Intel since my very first build I decided to try it out. And this CPU cannot be beat for the price. If you are planning on buying a CPU for a gaming rig, BUY THIS CPU. It blows the tits clean off any other Intel core at this price point, and every game I have thrown at it hits the 144 FPS mark. Before I upgraded (admittedly I was due for an upgrade, I'd been abusing the crap out of my i5 4690k with ridiculous overclocks) I had trouble reaching that 144fps on a couple games, namely warframe, GTA5, and Monster Hunter World. After this CPU, they all hit that cap across the board.\n\nPower consumption is relatively low for how much work it does, and the boost clock has run for about 2 weeks now without any instability or crashing.\n\nThe only thing you should look at is buying a better heat sink. While the one they include is certainly better than any stock heat sink I've ever used, testing Monster Hunter World for an hour got the temps up to 78° at max with it installed, usually hovering around the high 60s. While that's still technically a safe temperature... it's still a bit high for my tastes, especially since I'm tired of constantly keeping an eye on coretemp. Plus, the fan isn't the quietest thing in the world, and the settings I used had the fan hit full power at 67° which meant it was almost always running at full whack. So I threw an old coolermaster on and the same tests maxed out at 69° averaging about 60°, which is much better.\n\nMy mantra used to be Intel for CPUs and AMD for GPUs, but I'm an AMD man across the board now. I planned on buying the i9 9900k, but a friend told me to look into this CPU instead. I think I owe my friend a drink or two now since he saved me $200+!\n\nBear in mind, the computer I use this on is used almost exclusively for gaming. The fact that this CPU is only 6 cores for a newer model makes me think it was specifically designed with gaming in mind. I cannot speak for other applications that are CPU intensive, especially those that benefit greatly from multiple cores. But for every current gen game, even crappy ports like Monster Hunter, this CPU is top-notch quality for a mainstream price."", 'Esta é a primeira vez que uso um processador da AMD nos meus PCs. Depois de ler muitos reviews e comparativos decidi fazer a experiência e até o momento tudo está 100%. O principal fator que me fez optar pelo AMD Ryzen 5 3600X foi não só a sua performance, superior ao Intel Core i5-9600K, mas também a compatibilidade com as novas arquiteturas recém lançadas pela AMD. No caso da Intel, houve mudanças de socket depois da nona geração o que me colocaria sem possibilidade de upgrade sem a troca também da motherboard.\n\nFazer upgrade de CPU e Motherboard em um computador com o Windows instalado já foi uma enorme dor de cabeça, mas o processo com o Windows 10 foi extremamente tranquilo. Foi só trocar, ligar e o Windows fez (quase) tudo. Depois uma atualização de drivers e tudo certo.\n\nPara quem quer performance, escalabilidade e economia recomendo!', '', 'Excelente procesador.\n\nEl cambio ha sido notable desde un antiguo ryzen 3.\n\nLa multitarea ahora es muchísimo más agradecida y no se produce lag al pasar entre aplicaciones abiertas.\nEn juegos el cambio también ha sido sustancial puesto que ha aumentado considerablemente los FPS en todos los juegos probados y con las especificaciones gráficas al máximo.\n\nEl overclock es automático y desde la BIOS, gracias al A-XMP de la RAM, se ejecuta de manera muy sencilla y rápida alcanzando casi los 4.3 GHz sin tocar un botón. Las temperaturas muy comedidas, no ha pasado de 59º en ningún momento, aunque en mi caso, lo acompaño de una refrigeración liquida Corsair', '', ""Bottlenecking impossible. The included wraith spire cooler is silent under load and keeps it cool. Overclocking is simple with the AMD master application. Beautiful frames on cpu intensive games and the value is crazy. Would definitely recommend this over any Intel CPU. I don't plan on replacing this CPU for a veerry long time. One issue that I had though when installing on my Aorus B450 Pro Wifi board is that not all of the included screws were able to reach the intended holes. The cooler is in place though and has no wiggle action or any movement however. I spent much time on choosing the CPU and am intent on this choice. No real difference from the Ryzen 7 3700X other than that the included cooler is RGB lol"", 'Hardware (soweit relevant):\n\n- Prozessor: Ryzen 5 3600X ohne Overclocking (zuvor Ryzen 5 1600X)\n- Board: MSI X370 SLI PLUS\n- Prozessorlüfter: Arctic Freezer 13 Tower Kühler (gefiel mir von der Geräuschentwicklung schon auf dem 1600X, daher habe ich nicht den AMD Lüfter verwendet/ ASIN B0048F64DU)\n- RAM: 32GB Crucial Ballistix Sport LT BLS2K16G4D32AESC 3200 MHz mit Overclocking auf 3333Mhz (ASIN: B07M5RKH5Z)\n- Grafik: MSI Geforce GTX1060 6GB\n- Gehäuse: Be Quiet Silent Base 800\n\nAlso, erstmal das neueste BIOS auf\'s Board gezogen, den 3600X mit dem Artic Freezer 13 eingebaut, den Rest des Rechners wieder montiert/angeschlossen und los ging\'s.\n\nDas Plus an Performance war deutlich spürbar (z.B. beim Boot und beim Start von Anwendungen, aber auch bei Nutzung des Web) und auch messbar (z.B. Cinebench R20 Multicore +1013 Punkte/ Cinebench R15 Multicore +427).\n\nZu Beginn hatte ich auch das Problem, dass der Rechner im Leerlauf kaum unter 50 Grad (Celsius) zu bekommen war. Dann habe ich die aktuellen Chipsatz-Treiber installiert und siehe da, im Leerlauf nur noch 33-40 Grad und beim Stresstest kaum über 70 Grad (lässt sich auch auf ""ComputerBase"" im Forum nachlesen Post ""Ryzen 5 3600X zu hohe Temp"" Beitrag #20). Auch der Boost auf 4400 Mhz (angezeigt werden 4398 Mhz) funktioniert wie erwartet.\n\nWer dann noch wegen der Lüftergeräusche Probleme hat, kann die Lüfterkrurve anpassen.\n\nDer Ryzen 5 3600X kostet derzeit ca. 200 € und bietet damit eine sehr gute Upgrade Möglichkeit, gerade auch für ältere Boards. Den Ryzen 7 3700X bekommt man aber auch schon für ca. 90 € mehr (muss jeder für sich entscheiden). Das Plus an Leistung beim Wechsel vom 1600X auf den 3600X macht sich deutlich bemerkbar, nicht nur bei Benchmarks, sondern auch im täglichen Betrieb. Zu hohe Hitze lässt sich mit den aktuellen Chipsatz-Treibern beheben. Wem der AMD-Lüfter zu laut ist, sollte noch ein paar Euro in einen Alternativlüfter investieren.\n\nIch bin sehr zufrieden und die dritte Ryzen-Genaration dürfte auch die Letzte sein, die auf meinem Board noch läuft.', '', 'Doos geleverd geen processor. Inhoud van de doos is geopend en gestolen.', '']","12,102"
