name,category,price,store,ratings,reviews,reviews_nr
"AMD Ryzen 5 5500 6-Core, 12-Thread Unlocked Desktop Processor with Wraith Stealth Cooler",Computer Parts,86.99,Amazon,4.7 out of 5 stars,"[""I upgraded my old desktop with new (and inexpensive) MB and M2 SSD, but with old graphics card, PSU, and HHD ((for storage). I forgot to flash the BIOS. Didn't matter. Installed Linux and it runs perfectly. And fast. One thing to note. This CPU fan screws directly into the MB rather than clips onto a bracket. Therefore you need to install the CPU and fan BEFORE installing the MB into the case. Don't overtight the screws."", 'I built my daughter a PC that she could play 1080P ultra, 1440P Med/High, and some 4K Low games. She is running this CPU paired with an intel A770 GPU (upgraded from an older RX580). Given the GPUs that were tied to this build so far, the CPU has been handling the gameplay without becoming a bottle neck. It runs with a stock cooler at acceptable temps. All in all, this was a good budget build with good performance with current games (given the display settings we are using).', ""For me CPUs like this, which are budget CPUs are mostly about the price. For $100 USD or less this is an excellent buy. If it's more than that, uhhhh. I'll take the 5600 for $130 Bob.\n\nWhile this is a Zen 3 CPU, it's not PCIe gen4 and you should be aware of this before buying. It's not the same line of CPU that most Zen 3 CPUs which are Vermeer. This is Cezanne. There are 3 Cezanne CPUs, the other two are OEM only, meaning they only come in a PC you buy from a company that makes PCs like Dell, etc........ For the most part this isn't a problem because it's a budget CPU, however if you pair this with something like an AMD Radeon 6500 XT which only uses 4 PCIe lanes to connect to the CPU, you'll get bad performance. So don't do that.\n\nOtherwise as long as you pair this with at least an 8 PCIe lane GPU it works fine. You take a tiny hit in GPU performance but not enough to worry about.\n\nThe bigger hit comes with the NVMe drives, especially in 2023 and going forward. There are now MANY NVMe disks that are a lot faster than 4GB/s, and to give as simple explanation as I can, a PCIe lane is a serial data line. The way a PCIe device/bus works is by grouping a certain amount of lanes so that you get the speed of a single PCIe lane times the number of lanes you have. Any NVMe disk has 4 lanes. It also means the port you plug it into along with what it connects to (CPU, motherboard chipset) has 4 PCIe lanes that it will connect with. So, you get 4 PCIe lanes. So now you need to know the data speed for each lane. For PCIe gen3, the speed of each lane is 1GB/s. For PCIe gen4 the speed of each lane is 2GB/s. So, with this CPU, the best you can get is a data transfer rate of 4GB/s to an NVMe disk. That's it. The newest disks coming out the end of 2022, and 2023 can hit speeds near 9GB/s. Now, most data transfers to/from NVMe disks can't run at that speed. However many disks can run many data transfers faster than 4GB/s, so that means a CPU that runs PCIe gen3 is slowing down modern NVMe disks that can run gen4 or now gen5 speeds. But that's not a statement that has a clear meaning, because just because a disk is called gen4, it doesn't mean most of the data transfers to/from that disk will run at the full bandwidth of PCIe gen4 x4 lanes = 8GB/s. Most gen4 disks rarely hit that speed if ever. Only the most expensive ones do. BUT once again many will run different types of transfers above 4GB/s.\n\nSo that's the description of what it means to have PCIe gen3 when dealing with modern NVMe disks. You're going to slow down some of the data transfers, not all, depending on how fast (which also means more expensive) the disk is.\n\nYes for a general purpose PC build this is good enough and it's a low cost option that's really good at $100 USD or less. However if the price of this starts to get closer to the Ryzen 5600, I'd rather buy the 5600 because that's PCIe gen4 which is as good as it gets with an AMD AM4 motherboard."", ""I got this looking for something to match my RX 580 but also give me options for future upgrades and boy was this a good choice. While there is a pretty significant bottleneck (since it's paired with an RX 580), even in games like CS2 and Minecraft which are very CPU intensive, it never went above 70 degrees. Stress testing it never went over 76 degrees with the stock cooler.\n\nOverall, it is a great value for the budget market and I am happy that I could use this for my first ever build."", 'Sure, technology is moving so fast by the time you purchase the ""latest and greatest"" it\'s already outdated!\nTeaching a student of mine how to build a gaming PC decided to go with the Ryzen 5 5500 CPU.\nThe install onto an ASRock B450M Steel Series motherboard was a simple set-in and lock down. (He got it on the first try!)\nAlthough he just finished the build and took it home today I trust the Ryzen\'s as I have 2 of them in use out of my three gaming computers.\nGreat product by, what I think, is a great company. The Ryzen 5 5500 should run some of the latest games out there with no problems.\nWould definitely recommend.', 'For 90$ this is an amazing cpu, able to contend with nearly any game it works great. Very satisfied with this but i will say if you have the budget get a 5600 instead as the ram speed limit and pcie 3.0 connectivity on this do limit it quite a lot.', ""What a monster of a CPU this Ryzen 5 5500 is!\nI upgraded my 10 years old PC on budget and got a simple ASRock B550 motherboard, paired it with this CPU, a 10 years old Corsair 240mm liquid cooler, 16GB DDR4 3200 RAM, 256GB NVMe M2 SSD (3500 MB/s) and after applying new thermal paste and adjusting the intel based liquid cooler, I was able to slightly overclock this CPU from 3.6GH to 4.2GH. I didn't use the Stealth cooler fan, but it was a great deal t get the CPU and cooler for less than US$100. What a bargain!\nI ran several benchmarks and the CPU is pretty stable.\nYou simply can't go wrong with the Ryzen 5 5500 for a budget build, even in 2024!"", 'Very good for gaming and awesome price', 'Processador muito bom para jogos, não esquenta muito, entrega bem o prometido', '', 'El procesador AMD Ryzen 5 5500 es una excelente opción para aquellos que buscan un equilibrio entre rendimiento y precio en sus equipos de escritorio. Con su arquitectura Zen 3, este procesador ofrece un rendimiento sólido en una variedad de tareas, desde navegación web hasta juegos y aplicaciones de productividad.\n\nCon 6 núcleos y 12 hilos, el Ryzen 5 5500 es capaz de manejar multitarea de manera eficiente, lo que lo hace ideal para usuarios que realizan varias tareas simultáneamente. Con una frecuencia base de 3.2 GHz y una frecuencia máxima de impulso de hasta 4.0 GHz, este procesador ofrece un buen equilibrio entre potencia y eficiencia energética.\n\nAdemás, el Ryzen 5 5500 es compatible con las últimas tecnologías de AMD, como Precision Boost 2 y StoreMI, que ayudan a mejorar el rendimiento y la capacidad de respuesta del sistema. En resumen, el AMD Ryzen 5 5500 es una excelente opción para aquellos que buscan un procesador confiable y potente sin tener que romper el banco.', '', ""I used this processor to bring my sister's R5 1600 out of the stone age. Unfortunately, BIOS upgrades bricked her motherboard (not the fault of the CPU, bricking is unfortunately common for this series of motherboards, because Gigabyte did a horrible job), and I had to replace it, but the processor itself is dirt cheap compared to anything in its performance range, and is a solid upgrade to previous generation AM4 processors. Just make sure that your motherboard's BIOS will support it, or that you are comfortable updating your BIOS to one that will support it. And if you have a Gigabyte, and they require you to do two firmware updates and two BIOS updates to get there - rethink it."", 'Grymt bra pris jämfört med var jag kan/vill handla.', '', 'Llego al siguiente día, fácil instalación en una placa AM4, se mantiene fresco con el cooler stock que viene dentro de la caja.', '']","3,849"
"AMD Ryzen 5 4500 6-Core, 12-Thread Unlocked Desktop Processor with Wraith Stealth Cooler",Computer Parts,77.77,Amazon,4.7 out of 5 stars,"['The item worked great and shipping was fast. I have no issues.', ""I found myself in need of upgrading a Core i5 2500K to allow my daughter to play Fortnite with my son and I. I paired this Ryzen 5 4500 with a Gigabyte B450M DS3H WIFI board and 16GB of TForce DDR4, and completed the build with an Antec 520W power supply, a 500GB SSD, and a Radeon RX 6600 that I had sitting in the parts bin.\n\nI already had Windows 11 installed on the drive and it booted right up. I installed the appropriate drivers and then used CPU-z to run a stress test. Under 100% load using the included Wraith Stealth cooler, the max temp I saw was 85C. Since I run a Ryzen 9 7900x on my main rig, I am more than comfortable with Ryzen's ability to handle heat, and 85C is perfectly acceptable in my book. Despite running hot, the fan was nice and quiet the entire time. This was under stock settings - no tuning to the fan curve. During the stress test, the max wattage use by the CPU was right around 58. Right now while idling it is pulling 10 watts and sitting at 40C.\n\nThe only game I have installed right now is Fortnite. On Epic presets, 1080p, using the RX 6600, I was getting 40-55 FPS (which I consider perfectly playable on a budget-level system). On High presets I consistently pulled 60-70 FPS. I would get a little stuttering here and there, which I suspect is memory-bandwidth-related. In all fairness I haven't even opened the BIOS to tune any settings. GPU usage was at 100% and CPU was at maybe 75%-80%. I consider that a pretty efficient pairing, though you could possibly bump up to something like a 6750 XT to get a little more performance without the CPU becoming a bottleneck. In any case, this is sufficient performance for 1080p gaming on most modern titles running at higher settings (without raytracing of course). I'll be doing some additional benchmarks as I finish up the 100+GB downloads, and if there are any changes to my opinion I'll update this review.\n\nThere are definitely faster processors, some of which don't cost a whole lot more than this. But since my goal was to build a viable system that paired well with my existing hardware, this really hit the sweet spot in terms of price and performance."", 'Easy to install and performs very good on all games averaging a 2-8% usage on high detail games and high workloads.', '', '', ' The Ryzen 5 4500 is my favorite cpu from Amazon. It is very cheap and is a very powerful cpu. Doesn’t teach high temps at all while gaming even with stock cooler. This is good for mid-end builds and I would pair this cpu with nothing higher than like a 3060ti or a rx 6650xt since then it would bottleneck. This is amazing value for money when paired with a gtx 1660 or a rx 580. I would 100% recommend this to anyone not wanting to spend a lot on their cpu while still getting lots of good performance', 'The order was excellent, arrived in a very short time. The packaging is excellent. Works fine. The temperature is normal 42 degrees (The Summer at home 27). I installed the OS and a lot of programs. CPU temperature is stable.', 'warning this cpu has NO video output and MUST have a video card with it to work PERIOD.', ""So far everything has worked well with the cpu, i have had a few issues regarding my desktop microphone when switching, but that's okay. Overall it runs really really well and was a major step up from my 1500x. Thank you for the great product AMD. Keep up the hard work."", 'The mobo I installed this on was my son\'s ASUS ROG B350-F (I think we got it in 2020?), and it was still running the BIOS it came with (version 4207). The BIOS needs to be updated to at least version 6042 in order for the mobo to recognize it, or you\'ll just get the ""orange light of doom"" and the computer won\'t boot. Other manufacturers may have the same issue if the motherboard is a few years old, and you\'ll need to download and flash the BIOS **BEFORE** tearing everything apart. Be prepared before you start.', 'Muito bom, atendeu as necessidades', '', 'Procesador muy barato y bueno , para un pc de entrada esta mas que suficiente , por unos pocos pesos mas se puede conseguir un 5500 que es un poco mejor pero no es tanta la diferencia con este', '', ""Good upgrade from a AMD Athlon 200 GE. And honestly really runs smooth and no problems. Easy to overclock as you can overclock from 3.6 to 4.1 GHz. I use this to play games and it does fine as long as you have a good GPU to go along with it. Just make sure your motherboard bios are up to date before installing this CPU. Overall, if you're looking for something cheap and reliable this is a great place to start as some us just don't have crazy amounts of money."", 'The packaging is great no damage to the box everything looks great.', 'Processeur de haute qualité de Bonne perd', '']","1,957"
"AMD Ryzen 5 4600G, 6-Core, 12-Thread Unlocked Desktop Processor with Wraith Stealth Cooler",Computer Parts,96.12,Amazon,4.7 out of 5 stars,"['It just works so good, for the price it’s amazing with 6 cores and 12 threads at 4.2GHz it just works so much better than intel for the price, it scores around 8000+ on cinebench and has no trouble making my pc faster, I love it and paired with a 3060 Ti it moves my pc up to UFO ratings on userbenchmark, Just an all around amazing product for the price', ""So to start this off, when I bought this I was on a deep budget, and when I first got the CPU, I never thought much of it, but over all its really great for the price you pay, I got it for 90$, and its well worth the 90$ maybe 100.\n\nSo if you want good gaming performance about 60 Frames in a game, it can achieve higher frames up to 100+ in esports or competitive games if that's what your into, just make sure you have a good enough GPU, I personally recommended the AMD Radeon 6700XT, which has great gaming performance for the price, i got mine for 275$ used, or it would be 300$ new at time of purchase for me, 300$ is worth it, any higher not so much, but buy higher on your own will."", 'The performance of this cpu is unbelievable. It runs at low temperatures and the cpu fan never really spins up. The graphics are unmatched for the price point. It’s easy to install on the am4 platform. The speed is nice as well. It plays games at low settings really smoothly. I just started playing the surge. Really great value here.', 'It actually worked great for online gaming, I was able to play COD with this processor. I watched some YouTube vidoes before I bought it but it works as they decribed it would.', ""The Ryzen 5 4600G is a good budget choice for several reasons. 1.) It has an integrated GPU so if you don't want to use a GPU, you don't have to. That being said, you're not getting much better than E-Sports with this integrated GPU. But if that's all you're looking for, then it may be up your alley.\n2.) The price. I got mine for $99 flat and that's a great price full stop. 3.) Compatibility. This chip is compatible with many many AM4 motherboards. 4.) The performance. You should see performance that's only about 5% slower than a Ryzen 5 3600. I think you will have a hard time noticing that in 99% of situations. 5.) It sips power. Right now the max I have seen it use a max of 39 watts, and that's at 100% load. So I'm not sure if I need to put it under some sort of synthetic load or something to get it to hit 65W, but it's been really awesome so far.\n\nI recommend this processor wholeheartedly for people on a budget. If you can afford a 5600, the 5600X or higher, you should get it since they are faster, have more cache, and support things like PCI Express 4.0. But overall just a really good processor for the money."", ""don't motherboard yet, the cooler has bit hair and dust on it, kinda disapointed, got it used but I kinda expected bet came with a use of thermal paste it looks like but yah. if I don't clean it the cooler is like 7 dollars so I still got a better end of the deal, would have got a normal version though if I had know this. wish they would have done more to clean it, I am sure it will work though."", 'Boot up with this GPU gaming processor is so fast (120%) faster than the computer I replaced! I paired with an M.2 SSD and boot up is within 9 seconds! Incredible!', ""This is the processor in my audio DAW box. It works awesome. I'm happy."", 'This baby is very strong at running your applications. 3.7 Ghz is quite good.. it is a very resonable priced CPU with built in graphics.', 'Esse processador não deixa nada a desejar para quem quer trabalhar, ter uma resposta rapida no seu sistema, mesmo o mais atual, e rodar jogos populares com uma qualidade boa. Jogo League of Legends apenas com a integrada e 16gb de ram, e o fps chega a mais de 200. Obviamente não teste com jogos mega pesados, mas me deixou extremamente satisfeito, pois vim de um fx6300 de 2017. Ótimo custo-benefício.', '', 'Los gráficos integrados son suficientes para jugar algunis juegos recientes a configuración gráfica baja.', '', 'I have one since earlier, however this purchase was useless as I did not receive the MB I ordered at the same time, returned.', 'Został zakupiony w normalnej cenie 300 zł (60 euro). W przeciwnym razie zaleca się zakup 5600g lub 5500gt - +20% do mocy i 2 razy więcej Cach L3 16 Gb', '']","1,563"
AMD Ryzen 5 3600 3.6GHz 6 Core AM4 Desktop Processor Boxed,Computer Parts,83.99,Amazon,4.7 out of 5 stars,"['Bargain price for a really well performance CPU, very recommended, i paid eighty five and this is a steal for the performance it offers. More than enough for a gaming CPU, great for low cost PC. Mix it with an RX6600 and everything will work great at 1080p.', 'First off, the compact box does not come with a CPU cooler. Inside the tiny box, there is only the CPU, the all-important sticker, and a manual of installation.\n\nIf you are planning on buying a different cooling solution (my case came with an AIO), then this presentation is perfect. Brand new, it costs around the same as the few used models in Ebay located in North America.\n\nAccording to several reviewers, it is also just slightly worse than the 3600X so you are not losing much by going for the significantly cheaper model. I installed it on a B550M motherboard, and I had no issues so far. It is recognized by the BIOS as the advertised model.\n\nGranted, shipping was a bit strange, since it supposedly started in San Antonio, Texas, then appeared in Ohio three hours later. It was only delayed for two days from the original delivery date, so not much of a problem for me.\n\nIn conclusion, if you are planning on using a separate cooling solution and you want to stay on AM4, it is a very good buy.', ""Upgraded from a 1600. Obviously this is better. Threw it in a GA AB350. Had to upgrade BIOS (which I should have done anyhow). No extra mess beyond that. Is it good for gaming? It will do the job. Strongly depends on the game as to how well it will do. Some games are not CPU dependent. I run mainly Tarkov. Which is CPU dependent. And this upgrade was a marked improvement on performance. I could play on the old chip. But load times were very slow. Now my load times are about 1/4 the time. That's huge for me.\nWould I recommend this? If this is what your budget allows, it will do the job you need it to."", 'This is the best budget cpu for gaming for only $80. This thing is an absolute beast for gaming with the rx 5700xt, which is the best budget combo that is out right now. Worked great with my a520m board and delivers some insane performance for many games. Definitely would recommend!', 'If you are looking to up grade ur pc this is a good start my sons pc runs so much better now.', 'I used this for a budget build for my bedroom TV. It works for games like PoE and Valorant. Dont expect to crank the settings on red dead redemption 2 or Cyberpunk though. Gotta turn those settings down nowadays. Overall it’s decent, it does as I expected. Great for watching movies.', ""Purchased for 84$ and at that price this cpu can't currently be beat. It replaced a ryzen 1700x for my wifes home office pc and the higher base clock rate and zen 2 architecture improvements make it the superior cpu for 99% of tasks even though it has 2 less physical cores. Used it in a bios updated x370 mobo and have zero issues with it."", 'Got it while on sale, works great and came exactly as advertised! Easy to install and remove from the packaging. No issues!', 'sehr gut', '', 'There is nothing to dislike about this AMD CPU the performance per price is unbeatable, if you are building a 1080 gaming or video editing rig to a budget then this CPU is your best bet, it does everything well enough\nmy system consists of:MSI MPG X570 Gaming Plus Mobo, RYZEN 5 3600 CPU, 32GB DDR4 3200mhz Ram and a Radeon RX6600XT graphics card with 8gbs onboard Ram, i have no problem playing the latest games at 1080P getting around 150-180 fps as long as i dont max everything out graphics wise.\nAll my system components match each other well', 'Cpu mejor que el 2600 se nota el cambio me vino roto el primero que pedí pero el segundo perfecto', '', ""Très bon rapport qualité prix, très bien pour le gaming, niveau de config moyen, c'est un des meilleurs que vous pourriez trouver dans cette gamme de prix la, je vous le conseille vivement si il rentre dans votre budget, attention juste d'avoir une carte mère compatible avec le chipset am4, et d'avoir une carte graphique à part car il n'a pas de partie graphique intégré (comme à peu près tout les processeurs AMD)."", '', ""Buona qualità prezzo del processore. Prestazioni molto buone nonostante il processore abbia qualche anno alle spalle, regge molto bene. ATTENZIONE: il processore arriva senza dissipatore, Amazon riporta erroneamente i dati sull'annuncio."", '']",424
