name,category,price,store,ratings,reviews,reviews_nr
"AMD Ryzen 7 5700X3D 8-Core, 16-Thread Desktop Processor",Computer Parts,199.98,Amazon,4.8 out of 5 stars,"['I went from 3700x to this about a week ago, and have been impressed with the performance. Incredible upgrade for the price, especially in games that are hard on the CPU. My only recommendation is that you get a quality cooler for it because it can get hot.', 'Was planning on getting the 5800x3d but then I read that they will be releasing this, which is worth the money and a great upgrade from my old Ryan 5 5500, I get a huge boost in fps on games like valorant, fortnite, etc. and it gives a great boost on demanding games like squad, dcs, etc.', 'My 5700X3D greatly improved performance across the board from my previous 3600, and nears 5800X3D performance at a significant reduction in price. I was also able to undervolt it to reduce operating temp, and the chip has been perfectly stable. Very happy with this chip bringing new life to my older AM4 system!', 'I\'ve got a near 8 year old system that was still running a Ryzen 1700 and GTX 1080, on an MSI B350m Mortar motherboard. The first gen Ryzen had some issue with utilizing 3200mhz ram, I think the official max supported was like 2677mhz, so my RAM was always underclocked. Naturally after so long I was getting the itch for an upgrade.\n\nI didn\'t want to spend $1000 on an AM5 build just for my GPU to be bottlenecked and be forced to buy a $1200-2000 GPU, especially when my GTX 1080 is still surprisingly relevant by today\'s standards.\n\nFortunately my OLD MSI b350m motherboard put out a BIOS update for this processor which literally made it plug and play. Dropped in the new CPU and after taking a little while to boot up, everything ran like normal. After enabling XMP my RAM immediately went to the rated 3200mhz, no fuss, whereas my old Ryzen 1700 would make things very unstable after about 2733mhz.\n\nDepending on your motherboard there\'s some special options in the BIOS you can modify to make the chip run a lot cooler. I am using a 240mm AIO water cooler but the temps were approaching 90C on prime95. I enabled some of the undervolting options and that was making temps top out around 75C while boosting!\n\nI haven\'t had the opportunity yet to thoroughly test it in games yet, but the games I have played so far have been running noticeably better. That is of course on top of the obvious increase in speed in any other task compared to my Ryzen 1700. On top of all this I can consistently push it over 4GHz turbo on 1.15v whereas my 1700 was underclocked to 3.2GHz around 1.2v to be stable.\n\nMy intentions with this processor was to utilize the new 3D Vcache technology to ""future proof"" my AM4 system for at least a few more years to give GPU technology more time to develop and hopefully have some breakthrough where GPUs are better and not so much more expensive nowadays. Beyond the fact the m.2 drives are overkill for most tasks and it\'s still hard to find AM5 motherboards that have USB 4.0 slots.\n\nIn conclusion, this upgrade resulted in my RAM being able to be run at expected speeds or better, a much faster processor and much better gaming performance with lower power draw. It has allowed me to squeeze the last bit of life out of my AM4 board and give it a facelift, for the price of about $300 all in for the CPU, liquid cooler and paste.\n\nIn other words I saved about $1000-3000 in not having to upgrade to the AM5 platform that is still in it\'s infancy, and get to stay on the time tested AM4 platform while the newer platforms work out the kinks and there\'s better GPU options as well as USB 4 standards etc.\n\nIf you\'re on the fence about making the purchase, go for it. I bought this when the price dropped to $229 and at the time that was a $80ish discount from the 5800x3d for a processor that uses a lot less power for maybe a 5% difference in performance. If you care more about your power bill and heat being generated by your computer than a 5% increase in performance, and you\'re staying on the AM4 platform, MAKE THE PURCHASE!', ""Best bang for the buck for the AM4 platform for gaming. Great upgrade from a Ryzen 3 to this processor. Works fantastic in nearly all the games I play and is a steal at the price. If you want more productivity focused of a processor go with a Ryzen 7 5800X instead but for gaming this is where it's at."", ""IF you still on am4 its a no brainer its cheaper than the 5800x3d too and the 5700x3d does run a good bit cooler too :)\n\nIm running a gigabyte 370 k7 MB so i did squeeze some out of it sense mb has a external clock gen and so far its been stable sense i got it little over 2 weeks ago.\n\nNow if you running over 2560x1440p you not going too see huge gains from the 3d cache sense you more so gpu bound over that point. Tho i am running a samsung g9 5120x1440p with a 7900xtx and i do noticed small gains more so depends on the game too but were i noticed the big difference is in the 1% lows and min fps in my case. I also came from a 5800x YES i know .. but more so i needed too rma that cpu and needed another cpu on hand or i would've just been on using the 5800x till i go am5.\n\nOtherwise i been pretty impressed with the 5700x3d ;) Lower clocks it has vs the 5800x3d really aint a big deal either very low percentage between the 2 really."", ""Back in January 2020, I built a gaming PC with a Ryzen 2700X. The CPU served me well, but I did not win the silicon lottery (so ram would not run stable above 2933 MHz) and there was definitely stuttering - especially in the first 5-10 seconds after loading into a new map in a game.\n\nFast forward to April 2024, and I just upgraded the CPU/Cooler, and Case (it was cheaper to get a new case then to replace all of the noisy fans in the old case).\n\nThe first thing I noticed was how much cooler and efficient the 5700X3D runs compared to the 2700X it replaced. I was routinely seeing 58-63C temps (with spikes to 70+C) with the 2700X, and now I am running 40-45C (even sometimes as low as in the high 30C range, and occasionally 46-47C).\n\nSecond thing is the complete absence of stuttering. I never realized how back the stuttering was, I knew it wasn't good, but holy moley - it is soooooo smooth. Also, this CPU seems to sip power, unlike the 2700X, which loved to drink down power.\n\nThird, I am now running ram at an ultra stable 3200 MHz. This computer also is nearly dead silent - other than some minor coil whine from the PSU.\n\nI have seen significantly more stable frame rates (running a game at 120 fps now stays super close to 120 fps vs frequent dips to 60-80 fps. Microstuttering is now almost zero all the time, vs double digits percents all the time, and did I say super silky smooth gaming? Yes, I could have gotten the 5800X3D, but for me, this thing seems to be underutilized now, vs my always stressed out 2700X that was sweating out much higher temps with a nasty stutter at times. I might have built this a bit too quiet or it could be how cool this CPU runs, since instead of deafening fans, I can only barely hear some very muted electrical hisses and whines at times from the UPS severely manhandled PSU, even when gaming hard. The case is a DeepCool CH360 Digital and the cooler is an Arctic Freezer 36 A-RGB."", 'Produto chegou conforme o pedido. BOX, lacrado, nota fiscal enviada depois por PDF.', '', ""Was considering either a Ryzen 7 5700X3D or 5800X3D for gaming. This one is a bit cheaper than the 5800X3D, has close to the same performace, and a lot cheaper then switching to the 7000 series CPU's. Will keep your AM4 gaming system working great for some time before having to upgrade."", 'Muy buen procesador, si actualizas de la generación 3000 se nota mucho la diferencia.\nLlego bien embalado, solo una cosa no me mandaron mi pulparindo 🥲.', '', 'Danke', '', ""Great CPU that is for all intents and purposes a 5800X3D that couldn't meet the quality requirements. Clocks were a little low out of the box for my liking so a little manual tuning of PBO limits and a -25 CO on all cores has it running at 4.1GHz wll core and never strays over 75°C on an extended torture test. My last hurrah for AM4 and I think it's a good one!""]",203
"AMD Ryzen 7 3700X 8-Core, 16-Thread Unlocked Desktop Processor with Wraith Prism LED Cooler",Computer Parts,199.99,Amazon,4.8 out of 5 stars,"[""Summary:\nIf you want a mid-range machine that's future proof for at least the next few years, this fits the bill nicely. Get a chip that trades blows with an i9-9900K for $200 less and uses less power doing it. Yes, Intel's higher clock speed will allow it to be faster at certain workloads & games, but it's usually not by much. Regarding gaming, if you're running at 1080p or 1440p and not running a top of the line video card, the difference between the 3700x and 9900K is negligible. For workstation use, it's a no brainer, unless you want to up to a 3900x.\n\nBuilding computers and keeping up to date with all the latest hardware is my hobby and second job. I was an AMD guy back in the Athlon XP & Athlon 64 days, but once it was Sandy Bridge vs Buldozer, there was basically no reason to go AMD. For years, I built basically nothing but Intel Machines. Ryzen's intro was exciting to me, AMD is now competitive again! But other than a couple of builds for people, I skipped the first 2 generations. Now, Gen 2 chips are cheap, and Gen 3 chips can not only hold there own, but often outperform Intel in many tasks, sometimes even gaming! And even when they loose, it's not by much.\n\nSo the 3700x gives great performance for the money, but what about stability and easy of setup? Well, it's nearly as good as Intel. Regarding stability, I'd say their fantastic as long as you avoid AMD Video Card drivers, which are a bit flaky at the moment. But with an Nvidia card, rock stable. Now, I said nearly as good as intel due to the drivers, BIOS updates, and power and voltage situation. For most current intel systems, the platform is so mature that everything generally just works out of the box. No drivers or power plans required, Windows 10 knows what to do with the platform. But with AMD Zen 2, there are potential issues on older chip-sets and not being able to boot without BIOS updates, performance issues with older BIOS updates, etc. On top of that, you really want to get the chip-set drivers & power plans to have the best configuration. None of this is hard, but Intel is already so integrated into Windows 10. But with Ryzen gaining market-share at their current pace, integration and optimization will be there soon.\n\nMost of the time, you want to build a balanced system. Here are my CPU suggestions based on price points (Approximations)\n\n$500 to $800 builds: 1600X AF (Which is basically a 2600X)\n$800 to $1300 Builds: 3600\n$1200 to $2500 Builds: 3700X\n$1800 to $3400 Builds: 3900X\n$2500+ Builds: $3950X\n\nMy wife and I rebuild our gaming systems this past Holiday season. Here's my latest rig with this chip:\nProcessor: AMD 3700X\nVideo Card: Nvidia GTX 1070 (used)\nRAM: 32GB G-Skill Dual Channel 3600Mhz CAS16\nMotherboard: MSI X570 Carbon (Good For 3800X and below, VRMs may run hot on 3900X and above)\nSound: Sound Blaster Z\nSSD: 1GB A-DATA SX8200 Pro & 2x 2TB Crucial (1100 & MX500)\nPSU: Seasonic 750W Gold\nCase: Fractal Design Define C\nCPU Cooler: Noctua DH-15\nFans: 4x 140mm Noctua AF-14 & 1x 120mm Noctua AF-12\n\nGaming and productivity have been fantastic with no issues. I really want more GPU power, but I'm waiting for the prices to come down for Nvidia or for AMD to get their driver act together. GTX 1070s can be had for under $200 used, and compare well to GTX 1660 Supers (We got ours before this was an option). If you have the money The 2070 S would be my go to. I could have invested the cost of the expensive fans and CPU cooler to a faster video card or 3900x, but having a system that's quiet, cool, and fast is important to me.\n\nHere's to hoping Ryzen continues down this path!"", 'Good bang for your buck$! This was used for a new PC build, replacing my previous dinosaur which was also a AMD PC built back in Oct 2010. And its still running fine just thought I was overdue for an upgrade. And an Upgrade this is!!\n\nI wasnt much of a gamer before but I do a lot of video editing and processing and this 3700X has GREATLY increased my production wait times! Which freed up lots of time to do other things.\n\nI paired this CPU with a Gigabyte B550 AORUS ELITE V2 , 64GB Crucial Pro RAM, everything has worked great right out of the box. A $500 pc build\nBase clock is 3.6Ghz but during testing, everything set to auto in the bios, Im seeing 4.5~4.8 Ghz regularly on HWmonitor...maybe i won the silicon lottery?\n\nThe Wraith cooler is okay, it keeps things under 80C with fan running at 99%, it never hits 100%. Which i think its usable long term, but there are cheap options out there for air cooling. The cooler you keep things the longer they will last.\n\nOne issue i noticed is the heat from the cooler blows hot air on the ram and video card. Though Im am testing on a bench top, so this might change a little once i place inside my case with exhaust fans.\n\nNice CPU for the $ and its faster than my expectations ever were. I definitely recommend this to anyone looking for an upgrade.', ""This is by far the best computer processor I have ever used, it is fast and powerful. I have used it for 3D modeling, video editing, and gaming; It has surpassed all my expectations. Although AMD is releasing new processors soon, this model is still very strong and at a great price, which may drop post 5000 release.\n\nThe only problem I had with this processor was not the CPU itself, but the RGB Wraith Cooler. There are so many problems with this cooler that I can't recommend it. Yes, it works and I am in fact still using mine because I didn't budget for one, but I do plan on replacing it soon. Here is everything I found wrong with it:\n\n- It is a pain to install, especially for beginners. Rather than opting for screws or push pins, AMD designed a strange hook mechanism that is absolutely terrible. When installing the cooler, it feels like everything is going to break, and although I know I installed it correctly it didn't feel right.\n\n- It is LOUD! It's not unbearable, but it is annoying. Any time I open up a new app or do something that puts a tiny strain on the CPU, the Wraith speeds up a lot.\n\n- The RGB is a mess! The Prism Wraith has 3 individual RGB lights: the fan, the ring, and the logo. HOWEVER, only the fan can be controlled with external software (AURA SYNC, iCue, etc). If you wish to control all three LEDs, you have to use a separate app from Cooler Master, which requires you to attach a separate cable to one of your internal USB headers. Not to mention, you cannot use the Cooler Master software at the same time as another program, and they are not compatible. So you can either control just the fan LED, or you can control all three with a USB cable and sucky Cooler Master bloatware.\n\n- The cooling isn't very good. At idle it is fine, but gaming or using heavy software it just doesn't keep up very well.\n\nTL:DR - Buy this CPU if you need a good CPU and you don't want to wait for 5000, but budget for a better cooler the Wraith is very disappointing."", 'Muito bom potente ótimo incrível', '', 'Works like a dream', 'La verdad pensaba comprar un Ryzen 9 pero yo mayormente lo uso para juegos ya que tengo otro equipo para trabajar, así que después de evaluar vi que le rendimiento en juegos de este ryzen era realmente muy similar al del Ryzen 9 para la mayoría de los juegos, al menos hasta que salgan juegos que usen mas ""cores"" , así que este cumplía con todo inclusive disipador RGB el cual es muy llamativo, realmente una buena compra, usando la misma tarjeta de video que tenia antes ya regreso a ser un equipo muy competitivo yo juego en 2k de resolución ya que igual el presupuesto para jugar en 4k es mucho mayor, las temperaturas si son un poco elevadas entre 55-60 sin ejecutar nada y como unos 70C jugando, realmente no es nada tan escandaloso para un CPU de estos, además no hay nada de que preocuparse porque si la temperatura aumenta más el ventilador sube la velocidad y lo enfría bien rápido, en resumen no me queda mas que recomendarlos, yo use una placa madre con chispet b550m es una buen combo.\n\ncualquier cosa no duden en preguntar, más tarde adjunto imagenes.', '', 'świetny procesor 8 rdzeni i 16 wątków bardzo przyśpieszyło działanie mojego komputera jak i wydajność w grach nie doświadczam spadków fps w grach takich jak gta 5,wiedżmin 3, na ultra.\n\nW tej cenie to bardzo dobry wybór.', '', ""Purchased on 22nd Oct, assembled myself.\nAm using this system for video editing, gaming (Horizon 4) , and my work which involves big excel files.\nNo regrets yet as it performs as expected, (feels like an overkill sometimes 😋) I tried my max to utilize max juice out of it by coupling right components.\n\nChoice of other components is what decides the performance. If you use normal HDD with the Ryzen 7 3700X its waste. NVMe PCIe M.2 SSD is a must - since its directly connected to processor (in supported motherboard) it utilizes max bandwidth improving performance. For the Ryzen 7 3700X, you'll want to install 3000MHz or faster modules.\nOnly compromise i did was the cabinet. I did not go for flashy one; but cost effective and one which gives decent cooling solution. Do not spend over Rs.5,000 for cabinet. Divert the extra money on good components!!\n\nCoupled with MSI MAG X570 Tomahawk WiFi AMD ATX Gaming Motherboard with\n● G.SKILL 16GB DDR4 TridentZ RGB 3600Mhz PC4-28800 CL18 1.35V Dual Channel Kit (2x8GB) - F4-3600C18D-16GTZRX\n●Western Digital WD Blue NVME SN550 500GB M.2 2280 PCIe Gen3 Internal Solid-State Drive (WDS500G2B0C) for OS & APPS\n●Crucial P1 1TB 3D NAND NVMe PCIe M.2 SSD - CT1000P1SSD8 Storage\n● Antec HCG750 Bronze 80 Plus Bronze Certified 750 Watt Fully Modular Gaming Power Supply\n●ZOTAC Gaming GeForce RTX 2070 Super Mini 8GB GDDR6 Graphics Card\n● Deepcool MF120 GT - 3 in 1 with 20 Addressable RGB LEDs Across a Unique X Frame""]","27,417"
"AMD Ryzen 3 4100 4-Core, 8-Thread Unlocked Desktop Processor with Wraith Stealth Cooler",Computer Parts,68.97,Amazon,4.5 out of 5 stars,"[""I've had a 6th generation Intel CPU for the longest time and while back 6-7 years ago it would've been great, nowadays it was starting to show its age. This CPU is the best bang for your buck if you need a modern CPU upgrade without breaking the bank. It's not going to be the most powerful since it is last generations architecture with another core and some more cache, but if you need a nice upgrade, this is the way to go."", 'i ran games like gta v and a few others with it although it was better when i upgrade from this to a 5600x but i thought this worked well for me til i was ready for my cpu upgrade i had no problems id still use it to this day if i didnt have my system updated further', 'Was on a deal for about $60. Not out of this world performance but fairly well for that price point.', 'Product came 10 days after expected… did not work no fault to the manufacturer purchase. Shipping is based on estimate but has been consistently off every time i purchase. Give us realistic shipping in rural areas or nothing at all', ""So powerful. It makes me very happy I don't have to worry about if my computer can run a game. The answer is just yes."", '5 stars says it all', 'Great CPU for the money but the description said unlocked, that being said you cant OC this cpu through the ryzen master software for stable OC.\nIt does preform well for most tasks, web browsing, youtube, movies, and some other light task.\nGaming wise it tends to bottleneck, my GPU AMD Radeon RT 6650 XT runs smooth, the cpu goes to 100% on some games and it freezes up this is on medium to low settings.\nall in all good budget cpu but would recommend a cpu from the 5000 series for about 20 to 30 dollars more for a 5600 or 5600x.', ""Edit:\nMy stupid self totally forgot about the BIOS.\nA quick BIOS update(and a mini anxiety attack during the process as a power failure or crash will brick the motherboard😰) and the CPU fired to life, giving my pc speed it never had before!\n\nVery happy with the performance so far and now I can run my virtual machines, and Discord bot servers at the same time with next to no lag.\n\nHighly recommend this processor if you're looking to build a nice budget pc, or upgrade from a slower processor.\n\nOriginal:\nUnfortunately I can't provide a true review of this cpu as it was dead on arrival. And I had to go back to my old cpu.\n\nI'm going to clean it up, and put it back into the package."", 'I thought this was going to be slower than I thought. It keeps right up no graphics issues clean boots and quick launch times. More than expected. Most impressed.', 'No me imagine que el rendimiento iba a ser tan bueno.', '', 'Funcionar com rapidez e eficiência.', '', 'I had to fix a few bent pins and noticed a pin was broken, but still works!', 'Windows上ではRyzen3 4100として認識され、4コア8スレッドで動作しています。', '']",391
"AMD Ryzen 5 8500G 6-Core, 12-Thread Desktop Processor",Computer Parts,159.00,Amazon,4.6 out of 5 stars,"['Para ser un procesador de ultima generacion, excelente y el precio muy economico', '', '', '', "" The AMD Ryzen 5 8500G is a solid choice for budget-minded gamers or those looking for a capable processor for everyday tasks. It features 6 cores, 12 threads, and integrated Radeon 740M graphics, allowing you to play some less demanding games without a dedicated graphics card. It also boasts a strong performance-to-price ratio.\nHere’s a quick summary of the pros and cons to help you decide if the Ryzen 5 8500G is the right processor for you:\nPros:\n* Excellent value for price\n* Integrated graphics handle some light gaming\n* Supports DDR5 memory\nCons:\n* Fewer PCIe lanes compared to higher-end models\n* Might not be ideal for futureproofing due to fewer PCIe lanes\nOverall, the Ryzen 5 8500G is a great option for gamers on a budget or those who need a capable processor for everyday tasks. If you're looking for a future-proof option or plan on using a powerful graphics card, you might want to consider a higher-end model."", 'Solo debes actualizar la BIOS y todo marcha excelente.', '', 'Bueno si lo usas con gráfica, pero en mi caso que quise usar los gráficos integrados me sale el mensaje que dije anteriormente, no sé de qué es el problema pero no me permite jugar más de 15-30min porque crashea', '', 'Llego muy bien el producto, solo tuve un inconveniente al momento de instalarlo a la placa madre, tenía que actualizar la BIOS… luego todo bien, recomiendo el producto por su precio', '', 'Este CPU lo uso con la RTX4060 en los juegos que e probado a funcionado bien y no hace cuello de botela pero con el RTX ON en fornite.... Funciono pero el costaba, apartando eso funciona, sus temperaturas diria que son bajas a 50c° es lo maximo que e visto uso una refrigeración por aire el thermaligth phantom 120SE y junto con las pasta térmica que trae, lo cambiare pero en un año tal vez porque a como va es suficiente para mi ya que solo lo uso para jugar.', '', 'Bought for a new work computer (I know overkill for that but someone traded in a bunch of parts this was a good fit for) works so great, I have upped productivity 300% by not waiting for the old lag I dealt with, and when no one’s looking I can tab back to my game.', 'Lo instale para uso diario de oficina y va muy bien, cumple con lo prometido.', '', 'Parfait', '', '8500G is a fantastic processor, and overall performs quite well for the price. I appreciate it, has its drawbacks such as less PCIE lanes. But from my experience, hasn’t really impacted the performance of my GPU or the SSD. I will say this for me is a stop gap processor, and longevity could be an issue in a few years. But in the here and now, I couldn’t recommend it enough. For the price as well, with a decent IGPU it’s not a bad deal. Obviously, if you can I would recommend the 8600g or the 7600/x but I’m happy, with what it does and how it performs.']",49
